<?xml version="1.0" encoding="UTF-8"?>
<stx:sistemaTX idSistemaTX="TX001"
xmlns:stx="http://www.piat.upm.es/sistemaTransmision" 
xmlns:xsi="http://www.w3.org/2001/XMLSchema-instance"
xsi:schemaLocation="http://www.piat.upm.es/sistemaTransmision sistemaTransmision.xsd">
    <stx:subsistemaTX>
        <stx:NombreSubsistemaTX>subsi1</stx:NombreSubsistemaTX>
        <stx:nubeInformatica>
            <stx:nombreCompleto>
                nube informatica de la Tierra
            </stx:nombreCompleto>
            <stx:uri>
                http://uri.es/dela/nube1
            </stx:uri>
        </stx:nubeInformatica>
        <stx:modulosTXIntegrados>
            MODe0001 MODt0001 MODt0002 
        </stx:modulosTXIntegrados>
    </stx:subsistemaTX>
    <stx:subsistemaTX>
        <stx:NombreSubsistemaTX>subsi2</stx:NombreSubsistemaTX>
        <stx:nubeInformatica>
            <stx:nombreCompleto>
                nube informatica de la Tierra
            </stx:nombreCompleto>
            <stx:uri>
                http://uri.es/dela/nube2
            </stx:uri>
        </stx:nubeInformatica>
        <stx:modulosTXIntegrados>
            MODe0002 MODe0003 MODt0003 
        </stx:modulosTXIntegrados>
    </stx:subsistemaTX>
</stx:sistemaTX>